### ISSUE TITLE
Many message: url seed failed: 416 Requested Range Not Satisfiable

### ISSUE THREAD

**Issue by ximply** [arvidn/libtorrent#1364]
libtorrent version (or branch): 1.0.10
platform/architecture: Win7 x64
compiler and compiler version: vs2015

Add a http url to torrent, some times I can see many messages as follows:
url seed failed: 416 Requested Range Not Satisfiable

why this?

**Comment by arvidn** [comment]
there may be a bug. do you have an example torrent file and an example http request that fails with this message?

**Comment by ximply** [comment]
I want to give you a torrent file, but I add my http url dynamic and it has a expiration time， 5 minutes later the http url will expire so that I don't  know how to do. 
You can test it with your own torrent, and use nginx or other web server to setup a http download site then you can add the http url to your torrent, is this ok?

**Comment by arvidn** [comment]
could you capture a request in wireshark? I don't necessarily need to be able to reproduce it

**Comment by ximply** [comment]
Sorry, I have not a wireshark but I capture it with another tool.
file.mp4 size is 254,030,110 Bytes. 

Request:
GET /new/2016/11/17/file.mp4?k=2d66e8fb24ff278e614d79f26e6b0501&t=583E39B4 HTTP/1.1
Host: mydomain.com
Range: bytes=149192704-149422079

Response:
HTTP/1.1 416 Requested Range Not Satisfiable
Server: DOS/1.2.1.18
Date: Wed, 30 Nov 2016 02:36:22 GMT
Content-Type: text/html
Connection: keep-alive
Via: CNC-SXDT-C-197-174 (DLC-3.0)
Cache-Control: no-store
Content-Language: en
Warning: 113 DLC-3.0
Content-Length: 220

<HEAD><TITLE>Requested Range Not Satisfiable</TITLE></HEAD>
<BODY BGCOLOR="white" FGCOLOR="black">
<FONT FACE="Helvetica,Arial"><B>
</B></FONT>


</BODY>

**Comment by arvidn** [comment]
so, that implies that file.mp4 is smaller than 149422079 bytes, is that right?
If the file has that size or greater int the .torrent, I think the server is wrong, if the .torrent has that file as smaller, libtorrent is wrong.

you can look at the .torrent with the example program ``dump_torrent`` or some other tool.

**Comment by ximply** [comment]
**But file.mp4 size is 254030110 Bytes, is larger than 149422079.**

**Comment by ximply** [comment]
I install a wireshark, here is the captrue:
No.     Time                    Source                Destination           Protocol Length Info
   3855 2016-11-30 11:09:22.008 192.168.1.5           121.30.197.177        HTTP     262    GET /new/2016/11/17/file.mp4?k=8c20f8afe2a01b45c18e49f81cb26557&t=583E40E1 HTTP/1.1 

Frame 3855: 262 bytes on wire (2096 bits), 262 bytes captured (2096 bits)
    Encapsulation type: Ethernet (1)
    Arrival Time: Nov 30, 2016 11:09:22.008589000 马来西亚半岛标准时间
    [Time shift for this packet: 0.000000000 seconds]
    Epoch Time: 1480475362.008589000 seconds
    [Time delta from previous captured frame: 0.003471000 seconds]
    [Time delta from previous displayed frame: 0.000000000 seconds]
    [Time since reference or first frame: 9.146174000 seconds]
    Frame Number: 3855
    Frame Length: 262 bytes (2096 bits)
    Capture Length: 262 bytes (2096 bits)
    [Frame is marked: False]
    [Frame is ignored: False]
    [Protocols in frame: eth:ethertype:ip:tcp:http]
    [Coloring Rule Name: HTTP]
    [Coloring Rule String: http || tcp.port == 80 || http2]
Ethernet II, Src: Giga-Byt_06:e1:01 (40:8d:5c:06:e1:01), Dst: Hangzhou_f4:71:9a (58:66:ba:f4:71:9a)
    Destination: Hangzhou_f4:71:9a (58:66:ba:f4:71:9a)
        Address: Hangzhou_f4:71:9a (58:66:ba:f4:71:9a)
        .... ..0. .... .... .... .... = LG bit: Globally unique address (factory default)
        .... ...0 .... .... .... .... = IG bit: Individual address (unicast)
    Source: Giga-Byt_06:e1:01 (40:8d:5c:06:e1:01)
        Address: Giga-Byt_06:e1:01 (40:8d:5c:06:e1:01)
        .... ..0. .... .... .... .... = LG bit: Globally unique address (factory default)
        .... ...0 .... .... .... .... = IG bit: Individual address (unicast)
    Type: IPv4 (0x0800)
Internet Protocol Version 4, Src: 192.168.1.5, Dst: 121.30.197.177
    0100 .... = Version: 4
    .... 0101 = Header Length: 20 bytes (5)
    Differentiated Services Field: 0x00 (DSCP: CS0, ECN: Not-ECT)
        0000 00.. = Differentiated Services Codepoint: Default (0)
        .... ..00 = Explicit Congestion Notification: Not ECN-Capable Transport (0)
    Total Length: 248
    Identification: 0x7be5 (31717)
    Flags: 0x02 (Don't Fragment)
        0... .... = Reserved bit: Not set
        .1.. .... = Don't fragment: Set
        ..0. .... = More fragments: Not set
    Fragment offset: 0
    Time to live: 128
    Protocol: TCP (6)
    Header checksum: 0x0000 [validation disabled]
    [Header checksum status: Unverified]
    Source: 192.168.1.5
    Destination: 121.30.197.177
    [Source GeoIP: Unknown]
    [Destination GeoIP: Unknown]
Transmission Control Protocol, Src Port: 49568, Dst Port: 80, Seq: 1, Ack: 1, Len: 208
    Source Port: 49568
    Destination Port: 80
    [Stream index: 169]
    [TCP Segment Len: 208]
    Sequence number: 1    (relative sequence number)
    [Next sequence number: 209    (relative sequence number)]
    Acknowledgment number: 1    (relative ack number)
    Header Length: 20 bytes
    Flags: 0x018 (PSH, ACK)
        000. .... .... = Reserved: Not set
        ...0 .... .... = Nonce: Not set
        .... 0... .... = Congestion Window Reduced (CWR): Not set
        .... .0.. .... = ECN-Echo: Not set
        .... ..0. .... = Urgent: Not set
        .... ...1 .... = Acknowledgment: Set
        .... .... 1... = Push: Set
        .... .... .0.. = Reset: Not set
        .... .... ..0. = Syn: Not set
        .... .... ...0 = Fin: Not set
        [TCP Flags: 路路路路路路路AP路路路]
    Window size value: 16425
    [Calculated window size: 65700]
    [Window size scaling factor: 4]
    Checksum: 0x0168 [unverified]
    [Checksum Status: Unverified]
    Urgent pointer: 0
    [SEQ/ACK analysis]
        [iRTT: 0.011034000 seconds]
        [Bytes in flight: 208]
        [Bytes sent since last PSH flag: 208]
Hypertext Transfer Protocol
    GET /new/2016/11/17/file.mp4?k=8c20f8afe2a01b45c18e49f81cb26557&t=583E40E1 HTTP/1.1\r\n
        [Expert Info (Chat/Sequence): GET /new/2016/11/17/file.mp4?k=8c20f8afe2a01b45c18e49f81cb26557&t=583E40E1 HTTP/1.1\r\n]
            [GET /new/2016/11/17/file.mp4?k=8c20f8afe2a01b45c18e49f81cb26557&t=583E40E1 HTTP/1.1\r\n]
            [Severity level: Chat]
            [Group: Sequence]
        Request Method: GET
        Request URI: /new/2016/11/17/file.mp4?k=8c20f8afe2a01b45c18e49f81cb26557&t=583E40E1
            Request URI Path: /new/2016/11/17/file.mp4
            Request URI Query: k=8c20f8afe2a01b45c18e49f81cb26557&t=583E40E1
                Request URI Query Parameter: k=8c20f8afe2a01b45c18e49f81cb26557
                Request URI Query Parameter: t=583E40E1
        Request Version: HTTP/1.1
    Host: mydomain.com\r\n
    User-Agent: xt2.0.1/windows\r\n
    Connection: keep-alive\r\n
    Range: bytes=69058560-69206015\r\n
    \r\n
    [Full request URI: http://mydomain.com/new/2016/11/17/file.mp4?k=8c20f8afe2a01b45c18e49f81cb26557&t=583E40E1]
    [HTTP request 1/1]
    [Response in frame: 3864]

No.     Time                    Source                Destination           Protocol Length Info
   3864 2016-11-30 11:09:22.020 121.30.197.177        192.168.1.5           HTTP     559    HTTP/1.1 416 Requested Range Not Satisfiable  (text/html)

Frame 3864: 559 bytes on wire (4472 bits), 559 bytes captured (4472 bits)
    Encapsulation type: Ethernet (1)
    Arrival Time: Nov 30, 2016 11:09:22.020754000 马来西亚半岛标准时间
    [Time shift for this packet: 0.000000000 seconds]
    Epoch Time: 1480475362.020754000 seconds
    [Time delta from previous captured frame: 0.001300000 seconds]
    [Time delta from previous displayed frame: 0.012165000 seconds]
    [Time since reference or first frame: 9.158339000 seconds]
    Frame Number: 3864
    Frame Length: 559 bytes (4472 bits)
    Capture Length: 559 bytes (4472 bits)
    [Frame is marked: False]
    [Frame is ignored: False]
    [Protocols in frame: eth:ethertype:ip:tcp:http:data-text-lines]
    [Coloring Rule Name: HTTP]
    [Coloring Rule String: http || tcp.port == 80 || http2]
Ethernet II, Src: Hangzhou_f4:71:9a (58:66:ba:f4:71:9a), Dst: Giga-Byt_06:e1:01 (40:8d:5c:06:e1:01)
    Destination: Giga-Byt_06:e1:01 (40:8d:5c:06:e1:01)
        Address: Giga-Byt_06:e1:01 (40:8d:5c:06:e1:01)
        .... ..0. .... .... .... .... = LG bit: Globally unique address (factory default)
        .... ...0 .... .... .... .... = IG bit: Individual address (unicast)
    Source: Hangzhou_f4:71:9a (58:66:ba:f4:71:9a)
        Address: Hangzhou_f4:71:9a (58:66:ba:f4:71:9a)
        .... ..0. .... .... .... .... = LG bit: Globally unique address (factory default)
        .... ...0 .... .... .... .... = IG bit: Individual address (unicast)
    Type: IPv4 (0x0800)
Internet Protocol Version 4, Src: 121.30.197.177, Dst: 192.168.1.5
    0100 .... = Version: 4
    .... 0101 = Header Length: 20 bytes (5)
    Differentiated Services Field: 0x00 (DSCP: CS0, ECN: Not-ECT)
        0000 00.. = Differentiated Services Codepoint: Default (0)
        .... ..00 = Explicit Congestion Notification: Not ECN-Capable Transport (0)
    Total Length: 545
    Identification: 0x8938 (35128)
    Flags: 0x02 (Don't Fragment)
        0... .... = Reserved bit: Not set
        .1.. .... = Don't fragment: Set
        ..0. .... = More fragments: Not set
    Fragment offset: 0
    Time to live: 56
    Protocol: TCP (6)
    Header checksum: 0xb721 [validation disabled]
    [Header checksum status: Unverified]
    Source: 121.30.197.177
    Destination: 192.168.1.5
    [Source GeoIP: Unknown]
    [Destination GeoIP: Unknown]
Transmission Control Protocol, Src Port: 80, Dst Port: 49568, Seq: 1, Ack: 209, Len: 505
    Source Port: 80
    Destination Port: 49568
    [Stream index: 169]
    [TCP Segment Len: 505]
    Sequence number: 1    (relative sequence number)
    [Next sequence number: 506    (relative sequence number)]
    Acknowledgment number: 209    (relative ack number)
    Header Length: 20 bytes
    Flags: 0x018 (PSH, ACK)
        000. .... .... = Reserved: Not set
        ...0 .... .... = Nonce: Not set
        .... 0... .... = Congestion Window Reduced (CWR): Not set
        .... .0.. .... = ECN-Echo: Not set
        .... ..0. .... = Urgent: Not set
        .... ...1 .... = Acknowledgment: Set
        .... .... 1... = Push: Set
        .... .... .0.. = Reset: Not set
        .... .... ..0. = Syn: Not set
        .... .... ...0 = Fin: Not set
        [TCP Flags: 路路路路路路路AP路路路]
    Window size value: 248
    [Calculated window size: 126976]
    [Window size scaling factor: 512]
    Checksum: 0xf0f9 [unverified]
    [Checksum Status: Unverified]
    Urgent pointer: 0
    [SEQ/ACK analysis]
        [iRTT: 0.011034000 seconds]
        [Bytes in flight: 505]
        [Bytes sent since last PSH flag: 505]
Hypertext Transfer Protocol
    HTTP/1.1 416 Requested Range Not Satisfiable\r\n
        [Expert Info (Chat/Sequence): HTTP/1.1 416 Requested Range Not Satisfiable\r\n]
            [HTTP/1.1 416 Requested Range Not Satisfiable\r\n]
            [Severity level: Chat]
            [Group: Sequence]
        Request Version: HTTP/1.1
        Status Code: 416
        Response Phrase: Requested Range Not Satisfiable
    Server: DOS/1.2.1.18\r\n
    Date: Wed, 30 Nov 2016 03:09:21 GMT\r\n
    Content-Type: text/html\r\n
    Content-Length: 220\r\n
        [Content length: 220]
    Connection: keep-alive\r\n
    Via: CNC-SXDT-C-197-174 (DLC-3.0)\r\n
    Cache-Control: no-store\r\n
    Content-Language: en\r\n
    Warning: 113 DLC-3.0\r\n
    \r\n
    [HTTP response 1/1]
    [Time since request: 0.012165000 seconds]
    [Request in frame: 3855]
    File Data: 220 bytes
Line-based text data: text/html
    <HEAD><TITLE>Requested Range Not Satisfiable</TITLE></HEAD>\n
    <BODY BGCOLOR="white" FGCOLOR="black">\n
    <FONT FACE="Helvetica,Arial"><B>\n
    </B></FONT>\n
    \n
    \n
    </BODY>\n
    \000

**Comment by arvidn** [comment]
so, it sounds like you may need a different web server then. I don't see anything wrong with the request. Do you see any requests succeed? I think you should look into your server and understand what it supports and under what circumstances it responds with 416.

**Comment by ximply** [comment]
Well, I will try to use another web server these days.
