### ISSUE TITLE
It seems udp packet fragmented.

### ISSUE THREAD

**Issue by yutayu** [arvidn/libtorrent#7175]
**Please provide the following information**

libtorrent version (or branch):
libtorrent: 1.2.9.0
platform/architecture:
linux arm (raspi)
compiler and compiler version:
Deluge-gtk
Client: 2.0.3
Server: 2.0.3

please describe what symptom you see, what you would expect to see instead and
how to reproduce it.
11:28:11.293770 IP 180.42.xxx.73.56881 > 106.154.xxx.198.19251: UDP, length 1472
11:28:11.294334 IP 180.42.xxx.73 > 106.154.xxx.198: ip-proto-17
11:28:11.294359 IP 180.42.xxx.73.56881 > 106.154.xxx.198.19251: UDP, length 1472
11:28:11.294945 IP 180.42.xxx.73 > 106.154.xxx.198: ip-proto-17

This is ethernet-bridge router.
Behind Modem , MTU is 1500 but , Beyond modem MTU is 1454.
So I set MTU is 1454 at eth0.

**Comment by Seeker2** [comment]
Arvidn explained how libtorrent tries to adjust to MTU of the interface here:
https://github.com/Tribler/tribler/issues/2620#issuecomment-369940481

**Comment by PriitUring** [comment]
@yutayu

> libtorrent: 1.2.9.0

Can you reproduce with v1.2.18?

**Comment by yutayu** [comment]
@PriitUring 
I use delgue with raspberry os, This deluge version is little  bit old and I cannot upgrade it manually.
Then I close this issue.
I like deluge :)
